object_id,num_accounts
I guess my brother isnt good with advice 😬 @Aishah Sofey @CHRISTIAN.ARAUJOl #podcast #camilla #viral #IG #realcamillaara #CamillaAraujo #itscamillaara #money #tiktokuni #foryou #fyp #tiktok #fypシ゚viral #pov #foryoupage #fypツ,6
Discover the secret of jojoba & argan with Tgideas #collagen #hair #keratin #haircaretips #shinyhair#hairmask #tgideashairmask #straighthair  ,5
Is your hair dry and frizzy? Run to buy it!!! #collagen #hair #keratin #haircaretips #shinyhair #hairmask #tgideashairmask #straighthair  ,5
This mask does a good job. Removingthe hair deeply leaves it,5
 silky andsoft l honestly give it its 10 because itdeserves it.#hairmask#tgideashairmask #straighthair  #collagen #hair #keratin #haircaretips #shinyhair ,5
I guess my brother isnt good with advice 😬 @Aishah Sofey @CHRISTIAN.ARAUJOl#podcast #camilla #viral #IG #realcamillaara #CamillaAraujo #itscamillaara #money #tiktokuni #foryou #fyp #tiktok #fypシ゚viral #pov #foryoupage #fypツ,5
Guess who’s coming on the podcast 👀 @Sophie Rain#podcast  #camillaaraujo  #camill  #camillaauja  #IG  #realcamillaara  #Camilla  #CamillaAraujo  #itscamillaara  #foryou  #fypシ  #fypage  #funny  #funnyvideo  #money  #tiktok  #fyp  #crazy,5
Family therapy session… @aishah 🤍#podcast #camilla #viral #IG #realcamillaara #CamillaAraujo #itscamillaara #money #tiktokuni #foryou #fyp #tiktok #fypシ゚viral #pov #foryoupage #fypツ,5
I gave my brother $15,4
000 for making me VIRAL #podcast #camilla #viral #IG #realcamillaara #CamillaAraujo #itscamillaara #money #tiktokuni #foryou #fyp #tiktok #fypシ゚viral #pov #foryoupage #fypツ,4
should i be mad chat #podcast #camilla #viral #IG #realcamillaara #CamillaAraujo #itscamillaara #money #tiktokuni #foryou #fyp #tiktok #fypシ゚viral #pov #foryoupage #fypツ,4
Replying to @Brianna Mizura #pov everyone must follow the theme of the day or else…(PART2) ##outfit##sabrinacarpenter##theme##storytime##fyp,3
Its over… @Sophie Rain #podcast #camilla #viral #IG #realcamillaara #CamillaAraujo #itscamillaara #money #tiktokuni #foryou #fyp #tiktok #fypシ゚viral #pov #foryoupage #fypツ,3
Someone call the police 😂 #podcast #camilla #viral #IG #realcamillaara #CamillaAraujo #itscamillaara #money #tiktokuni #foryou #fyp #tiktok #fypシ゚viral #pov #foryoupage #fypツ,3
4 MILLION DOLLARS! @Sophie Rain #podcast #camilla #viral #IG #realcamillaara #CamillaAraujo #itscamillaara #money #tiktokuni #foryou #fyp #tiktok #fypシ゚viral #pov #foryoupage #fypツ,3
Guess who’s coming on the podcast 👀 @Sophie Rain #podcast #camilla #viral #IG #realcamillaara #CamillaAraujo #itscamillaara #money #tiktokuni #foryou #fyp #tiktok #fypシ゚viral #pov #foryoupage #fypツ,3
#fyp #foryou #podcast #funny #storytime Glittercheese #tiktokuni #fypシ゚viral #pov #foryoupage #fypツ 😊,3
actually he NEEDS to join the rates @ScopeTheTea posted the vid and i have nobody to talk to #daniellebregoli #bhadbhabie #gossip #yapping,2
Its over… @Sophie Rain#podcast #camilla #viral #IG #realcamillaara #CamillaAraujo #itscamillaara #money #tiktokuni #foryou #fyp #tiktok #fypシ゚viral #pov #foryoupage #fypツ,2
Why im mad at sophie…#podcast #camilla #viral #IG #realcamillaara #CamillaAraujo #itscamillaara #money #tiktokuni #foryou #fyp #tiktok #fypシ゚viral #pov #foryoupage #fypツ,2
#gypsysisters#gypsysisterstlc#gypsysistersclips#gypsysistersupdates#gypsy#americangypsy#romani#familydrama#gypsywedding#tlc,2
The American accent lmao! Brand NEW #TappedOut drops TOMORROW 3rd December at 6pm on Channel 4.0 YT @Nella Rose @Specs Gonzalez @Konan @Mimi The Music Blogger,2
Trans TikToker and former Voice US contestant,2
 @sasha allen ,2
 has hard launched his relationship with former drag race star @Adore Delano. Sasha shared a snap of them both on his instagram with the ca,2
#amish #amishtiktok #amishlife #wereallinsane #podcast #trendingtopic #tiktokuni #fypシ゚viral #pov #foryoupage,2
I’m sorry,1
 but I have to tell you it’s a great deal right now!!!🔥🔥🔥 #laborday #falldealsforyou #tiktok #tiktokshop #ootd #fashion #blackFriday #christmas #blackfridaydeals #fall#tiktokshopholidayhaul #shophalloween #longsleeve #set #jacket #pants #solid #simple #zipper #pocket #casual #stylish #street #streetfashion #streetwear #fallclothes #outfit #fit #2pcset #sports #tiktokshopblackfriday#tiktokshopcybermonday#tiktokshopholidaydeals #spotlightfinds #falldealsforyou ,1
Actually this is very convenient to use #liveoutlandish #men #menwallet #wallet #wallets #ttshop #TikTokShop #TikTokMadeMeBuylt #foryou #deals #daily #vairl #OOTD #fashion #tiktokshopblackfriday #tiktokshopcybermonday #spotlightfinds #falldealsforyou ,1
We can’t believe a dad would say this. Should we have accepted his offer? #FlyAmalfi #PrivateJet #LuxuryTravel #Influencer #Aviation,1
McKenna calls back to book a trip and it doesn’t go as planned. How should we handle this? #FlyAmalfi #LuxuryTravel #Mckenna #PrivateJet #Travel,1
I seen clips alledging that she was #arrested but i dont know how much of that is true yet. #nursehannah #hannah #burnur #sad #MomsofTikTok #burnurcaughtthat #blowthisup #hannahbhiatt #bhiattfamily #bhiatt #nursesoftiktok #fyp #justiceforjamesbhiat #jamesbhiatt #foryoupage #educationalpurposes #educationalpurposesonly ,1
How well would you have done? #trivia #triviachallenge #questions #triviagame #extramedium #michigan #tiktokUS ,1
TikTok Ban Upheld by the U.S. Court Of Appeals D.C. Circuit #tiktokban #news #breakingnews #tech #keeptiktok #courtofappeals #court #law#scarecam #funnyvideos #scareprank#funnymoments #fail#prankvideo #funny #troll #funnyvideo #funnyprankvideos #prank#prankvideo #funnyprank #fyp#funnypranks,1
This was a crazy trip request. Would your dad do this? #FlyAmalfi #PrivateJet #Travel #Billionaire,1
McKenna calls back to book a trip and it doesn’t go as planned. How should we handle this? #FlyAmalfi #LuxuryTravel #Mckenna #PrivateJet #Travel ,1
Replying to @Haley Benoist Part 5 of Lana is rude on boyfriend’s sister’s wedding day. #bride #bridetobe #bridal #engaged #funnyskits #dramaskits #contentwriter #familyskits #storyteller #wedding #weddingplanner #weddingcontent #weddingtiktok #weddingday #weddingdress #weddingtok #bridetok #brideandgroom #weddingvibes #weddingplanning #weddingcontentcreator ,1
Replying to @Haley Benoist Part 3of Lana is rude on boyfriend’s sister’s wedding day. #bride #bridetobe #bridal #engaged #funnyskits #dramaskits #contentwriter #familyskits #storyteller #wedding #weddingplanner #weddingcontent #weddingtiktok #weddingday #weddingdress #weddingtok #bridetok #brideandgroom #weddingvibes #weddingplanning #weddingcontentcreator,1
A message to my old boss 🫶🏼 #podcast  #camillaaraujo  #camill  #camillaauja  #IG  #realcamillaara  #Camilla  #CamillaAraujo  #itscamillaara  #foryou  #fypシ  #fypage  #funny  #funnyvideo  #money  #tiktok  #fyp  #crazy ,1
@KaleyCuoco  says taking care of a toddler is like taking care of your drunk best friend every day 😂 #FallonTonight  #TonightShow  #KaleyCuoco  #JimmyFallon  ,1
Well that wasn’t supposed to happen 😂🦃    🎥 ViralHog    #happythanksgiving  #turkey  #disaster,1
New hire is a cat #fyp  #comedy  #funny  #construction  #rickyandtheboss  #breadstickricky  #roughneckroscoe,1
#jahmyrgibbs #lionsfootball #dancampbell #tiktoktea #tiktoknews #thetea #drama #playcalls #popculture #popculturenews #SportsNews,1
like there’s a reason it was part of the “sleeping beauties” exhibit last year y’all #wicked #wickedthemusical #wickedmovie #arianagrande #ariana #rembeauty #glinda #foryoupage #fypage #fyp,1
Alix wants to marry Braxton! 🥹♥️ #alixearle #hotmess #fyp #podcast #braxtonberrios ,1
Braxton doesn’t care if Alix parties! #alixearle #hotmess #fyp #podcast #braxtonberrios ,1
Braxton doesn’t care if Alix parties! #alixearle #hotmess #fyp #podcast #braxtonberrios,1
thank you to everyone in my life that suggested a mimosa for 2024 #turkeytrot #married #mimosa #thanksgiving #justagirl #knoxville,1
Replying to Lexi Lex max prank here you go  #kaicenat #max #trending #viral #stream #blowthisupforme #subathonstream,1
Al shaeer faces LIFETIME BAN after dirty hit #waronvegas #sportsbettor #gambletok #jagsfans #trevorlawrence #trevorlawrence16 #texansfans(1),1
httpswww.em.com.brgerais202411amp7000718-fotografo-mineiro-esta-desaparecido-ha-5-dias-em-paris.html #desaparecido #paris #frança(1),1
Replying to @Lexi Lex max prank here you go  #kaicenat #max #trending #viral #stream #blowthisupforme #subathonstream ,1
