object_id,num_accounts
part1+😭😭@TheJubalShowJubalinthemorningradioprogram“BrookeandJubal”#brookeandjubal#brookandjubalinthemorning#seconddate#seconddateupdate#prank”,8
Bad Bunny will be a performer at the2026 Super Bowl LX Halftime Show on Apple Music #news #badbunny #SuperBowl #noticiastiktok #MLB,6
The2025/26LaLigaseasonhasbegun!LivebroadcastisnowunderwayonTVWANSports 403.22&4#kickoff#laliga#FootballlsBack#NewSeason,5
Every frame is an iconic scene! The hidden details in this movie are noticed by only 10% of viewers on their second watch！#MovieTok#FilmClips#FYP#Entertainment#ClassicMovies,4
hillies land All-Star closer Jhoan Duran ahead of MLB rade deadline#JhoanDuran#MLBTradeDeadline#Phillies #BaseballUpdates#SportsNews,4
Bad Bunny will be a performer at the2026 Super Bowl LX Halftime Show on Apple Music #news #badbunny #SuperBowl #noticiastiktok #MLB  ,2
The latest condition of the mosque PONPES AlKhozinySidoarjo collapsed during Asrprayer#jtvjember #evakuasi #sidoarjo #fyp ,2
Kondisi terkini mushola PONPES Al Khoziny Sidoarjo ambruk saat salat ashar #jtvjember #evakuasi #sidoarjo #fyp,1
Bad Bunny will be a performer at the2026 Super Bowl LX Halftime Show on Apple Music #news#badbunny #SuperBowl#noticiastiktok #MLB,1
Bad Bunny will be a performer at the2026 Super Bowl LX Halftime Show onApple Music.#news #badbunny#SuperBowl #movie #fyp,1
"@TheJubalShowJubalinthemorningradioprogram""BrookeandJubal"" #brookeandjubal#brookandjubalinthemorning#seconddate#seconddateupdate#prank",1
The 2025/26 La Liga season has begun! Live broadcast is now underway on TVWAN Sports 403.22&4#kickoff#laliga#FootballlsBack#NewSeason,1
Ting ting and bilqis concert blackpink deadline #ayutingting#bilqis #blackpink #deadlineworldtour #CapCut,1
Tingtingandbilqisconcertblackpinkdeadline#ayutingting#bilqis#blackpink #deadlineworldtour#CapCut ,1
Tingtingandbilqisconcertblackpinkdeadline#ayutingting#bilqis#blackpink#deadlineworldtour#CapCut,1
