object_id,num_accounts
Discover the secret of jojoba & argan with Tgideas #collagen #hair #keratin #haircaretips #shinyhair#hairmask #tgideashairmask #straighthair  ,6
Is your hair dry and frizzy? Run to buy it!!! #collagen #hair #keratin #haircaretips #shinyhair #hairmask #tgideashairmask #straighthair  ,6
This mask does a good job. Removingthe hair deeply leaves it,6
 silky andsoft l honestly give it its 10 because itdeserves it.#hairmask#tgideashairmask #straighthair  #collagen #hair #keratin #haircaretips #shinyhair ,6
Its over… @Sophie Rain #podcast #camilla #viral #IG #realcamillaara #CamillaAraujo #itscamillaara #money #tiktokuni #foryou #fyp #tiktok #fypシ゚viral #pov #foryoupage #fypツ,4
Someone call the police 😂 #podcast #camilla #viral #IG #realcamillaara #CamillaAraujo #itscamillaara #money #tiktokuni #foryou #fyp #tiktok #fypシ゚viral #pov #foryoupage #fypツ,4
should i be mad chat #podcast #camilla #viral #IG #realcamillaara #CamillaAraujo #itscamillaara #money #tiktokuni #foryou #fyp #tiktok #fypシ゚viral #pov #foryoupage #fypツ,4
#fyp #foryou #podcast #funny #storytime Glittercheese #tiktokuni #fypシ゚viral #pov #foryoupage #fypツ 😊,4
#amish #amishtiktok #amishlife #wereallinsane #podcast #trendingtopic #tiktokuni #fypシ゚viral #pov #foryoupage,4
400 THOUSAND DOLLARS! @julia❣️ #podcast #camilla #viral #IG #realcamillaara #CamillaAraujo #itscamillaara #money #tiktokuni #foryou #fyp #tiktok #fypシ゚viral #pov #foryoupage #fypツ,3
are yall enjoying the episode so far? #puckerupwithjoelylive #malachibarton #stuckinthemiddle #arianagreenblatt #disneychannel @Malachi Barton ,2
The American accent lmao! Brand NEW #TappedOut drops TOMORROW 3rd December at 6pm on Channel 4.0 YT @Nella Rose @Specs Gonzalez @Konan @Mimi The Music Blogger,2
Trans TikToker and former Voice US contestant,2
 @sasha allen ,2
 has hard launched his relationship with former drag race star @Adore Delano. Sasha shared a snap of them both on his instagram with the ca,2
imagine playing CSGO with a 100% keyboard….I couldnt do it. #xbox  #xboxkeyboard  #8bitdo  #8bitdokeyboard  ,2
Yall netter not eat no butterball turkey this year!! 😭#butterballturkey #thanksgiving #fyp #thanksgivingdinner #greenscreenvideo ,2
I gave my brother $15,2
000 for making me VIRAL #podcast #camilla #viral #IG #realcamillaara #CamillaAraujo #itscamillaara #money #tiktokuni #foryou #fyp #tiktok #fypシ゚viral #pov #foryoupage #fypツ,2
Family therapy session… @aishah 🤍#podcast #camilla #viral #IG #realcamillaara #CamillaAraujo #itscamillaara #money #tiktokuni #foryou #fyp #tiktok #fypシ゚viral #pov #foryoupage #fypツ,2
Its over… @Sophie Rain#podcast #camilla #viral #IG #realcamillaara #CamillaAraujo #itscamillaara #money #tiktokuni #foryou #fyp #tiktok #fypシ゚viral #pov #foryoupage #fypツ,2
Why im mad at sophie…#podcast #camilla #viral #IG #realcamillaara #CamillaAraujo #itscamillaara #money #tiktokuni #foryou #fyp #tiktok #fypシ゚viral #pov #foryoupage #fypツ,2
Braxton doesn’t care if Alix parties! #alixearle #hotmess #fyp #podcast #braxtonberrios,2
I’m sorry,1
 but I have to tell you it’s a great deal right now!!!🔥🔥🔥 #laborday #falldealsforyou #tiktok #tiktokshop #ootd #fashion #blackFriday #christmas #blackfridaydeals #fall#tiktokshopholidayhaul #shophalloween #longsleeve #set #jacket #pants #solid #simple #zipper #pocket #casual #stylish #street #streetfashion #streetwear #fallclothes #outfit #fit #2pcset #sports #tiktokshopblackfriday#tiktokshopcybermonday#tiktokshopholidaydeals #spotlightfinds #falldealsforyou ,1
Actually this is very convenient to use #liveoutlandish #men #menwallet #wallet #wallets #ttshop #TikTokShop #TikTokMadeMeBuylt #foryou #deals #daily #vairl #OOTD #fashion #tiktokshopblackfriday #tiktokshopcybermonday #spotlightfinds #falldealsforyou ,1
Part:2 #greenscreenvideo #greenscreen #nursehannah #tiktokuni #fypシ゚viral #pov #foryoupage #fypツ 😐,1
@KaleyCuoco  says taking care of a toddler is like taking care of your drunk best friend every day 😂 #FallonTonight  #TonightShow  #KaleyCuoco  #JimmyFallon  ,1
Well that wasn’t supposed to happen 😂🦃    🎥 ViralHog    #happythanksgiving  #turkey  #disaster,1
A message to my old boss 🫶🏼 #podcast  #camillaaraujo  #camill  #camillaauja  #IG  #realcamillaara  #Camilla  #CamillaAraujo  #itscamillaara  #foryou  #fypシ  #fypage  #funny  #funnyvideo  #money  #tiktok  #fyp  #crazy ,1
Alix wants to marry Braxton! 🥹♥️ #alixearle #hotmess #fyp #podcast #braxtonberrios ,1
Braxton doesn’t care if Alix parties! #alixearle #hotmess #fyp #podcast #braxtonberrios ,1
“You looking for a job” 😂 I interviewed a multimillionaire business owner in Beverly Hills. I asked him why he pursued his industry and his secret to sales throughout his career. I also asked him for,1
Al shaeer faces LIFETIME BAN after dirty hit #waronvegas #sportsbettor #gambletok #jagsfans #trevorlawrence #trevorlawrence16 #texansfans(1),1
httpswww.em.com.brgerais202411amp7000718-fotografo-mineiro-esta-desaparecido-ha-5-dias-em-paris.html #desaparecido #paris #frança(1),1
